{
  "pattern_id": "STOCKINETTE",
  "version": "1.0.0",
  "name": "Stockinette",
  "technique": "knitting",
  "repeat": {
    "width_stitches": 1,
    "height_rows": 2
  },
  "rows": [
    {
      "row": 1,
      "side": "NA",
      "sequence": [
        {
          "op": "K",
          "n": 1
        }
      ]
    },
    {
      "row": 2,
      "side": "NA",
      "sequence": [
        {
          "op": "P",
          "n": 1
        }
      ]
    }
  ],
  "source": {
    "type": "internal",
    "reference": "Canonical construction",
    "license": "Internal definition"
  }
}